{"schemaVersion":1,"artifactType":"report-request","createdAt":"2026-08-19T10:00:00Z","requestId":"report-request-001","projectRoot":"C:\\projects\\example","profileId":"profile-0123456789abcdef","property":"properties/200","question":"What changed?","language":"en","period":{"mode":"last-complete-days","days":28,"from":null,"to":null},"comparisons":["previous-period"],"presets":["overview"],"includeToday":false,"experimentalFunnel":false,"alphaDisclosureAccepted":false,"baselineRef":null,"measurementPlanRef":null,"customCore":null,"contentSha256":"d7046e95f25d58079eb735c15479b7d273a7c634a1a7f515481e6cf18f320f9b"}
